"No.","Time","Source","Destination","Protocol","Length","Info"
"1","0.000000","192.168.1.16","147.144.1.212","HTTP","527","GET / HTTP/1.1 "
"2","0.002712","147.144.1.212","192.168.1.16","TCP","1514","80  >  60118 [ACK] Seq=1 Ack=462 Win=520 Len=1448 TSval=3138252895 TSecr=382269243 [TCP segment of a reassembled PDU]"
"3","0.002715","147.144.1.212","192.168.1.16","TCP","1514","80  >  60118 [ACK] Seq=1449 Ack=462 Win=520 Len=1448 TSval=3138252895 TSecr=382269243 [TCP segment of a reassembled PDU]"
"4","0.002748","147.144.1.212","192.168.1.16","TCP","1355","80  >  60118 [PSH, ACK] Seq=2897 Ack=462 Win=520 Len=1289 TSval=3138252895 TSecr=382269243 [TCP segment of a reassembled PDU]"
"5","0.004885","147.144.1.212","192.168.1.16","TCP","1514","80  >  60118 [ACK] Seq=4186 Ack=462 Win=520 Len=1448 TSval=3138252895 TSecr=382269245 [TCP segment of a reassembled PDU]"
"6","0.004890","147.144.1.212","192.168.1.16","TCP","1514","80  >  60118 [ACK] Seq=5634 Ack=462 Win=520 Len=1448 TSval=3138252895 TSecr=382269245 [TCP segment of a reassembled PDU]"
"7","0.004937","147.144.1.212","192.168.1.16","TCP","1514","80  >  60118 [ACK] Seq=7082 Ack=462 Win=520 Len=1448 TSval=3138252895 TSecr=382269245 [TCP segment of a reassembled PDU]"
"8","0.004938","147.144.1.212","192.168.1.16","HTTP","899","HTTP/1.1 200 OK  (text/html)"
